{
  "dataset": "d365-finops-pqu",
  "schema_version": "1.1.0",
  "status": "degraded",
  "checked_at": "2026-10-19T19:11:52.848489Z",
  "last_successful_check_at": "2026-10-19T19:11:52.848489Z",
  "last_successful_publish_at": "2026-10-19T19:11:52.848489Z",
  "last_source_change_at": "2026-10-19T19:11:52.848489Z",
  "source_reachable": true,
  "parser_success": true,
  "validation_passed": true,
  "records": 59,
  "current_records": 6,
  "upcoming_records": 16,
  "warning_count": 1,
  "error_count": 0,
  "check_interval_minutes": 60,
  "source_commit": "cb977385a7ab71c306533725527086bc30d9f548",
  "source_sha256": "2cc9773677d90a03e730b761f4f7825cde114e0f72564b27e14fae4ae902a588"
}
